text,audioName,ticksUntilNext
"Hey James, What's up? Ready for our backyard experiment of our teleportation machine?",None,300
"Alright, let's go to our backyard, and see if it works!",None,800
"Okay James, open up that tablet, and wirelessly start the teleportation machine!",None,0
"Yeaah!! We got this started now!! (But Unforeseen consquences await, it explodes and insert black mesa reosnance cascade)",None,0
"Yeaah!! We got this started now!! (But Unforeseen consquences await, it explodes and insert black mesa reosnance cascade)",None,0
